year,headline,source,sentiment,summary
2015,AMRUT Launched for Urban Transformation,Times of India,positive,500 cities to get improved basic services
2016,Rs 77000 Crore Action Plans Approved,The Hindu,positive,States plan massive urban infrastructure investment
2017,Municipal Finance Reforms Mandated,Indian Express,positive,Cities required to improve revenue and governance
2017,45 Lakh Households Get Water Supply,Economic Times,positive,Urban water access expands significantly
2018,139 Lakh Households Benefit from AMRUT,Business Standard,positive,Mid-term progress shows substantial coverage
2018,Cities Encouraged to Issue Municipal Bonds,The Hindu,positive,Innovative financing for urban development
2019,AMRUT 1.0 Targets Substantially Achieved,Times of India,positive,First phase meets core objectives
2019,2 Crore Households Get Urban Water,Indian Express,positive,Major milestone in urban water supply
2020,COVID Highlights Urban Water Needs,Economic Times,neutral,Pandemic shows importance of water infrastructure
2020,Handwashing Stations Under AMRUT,Business Standard,positive,Hygiene infrastructure for pandemic response
2021,AMRUT 2.0 Launched for All Towns,The Hindu,positive,Universal urban coverage announced
2021,Water Security Focus in AMRUT 2.0,Times of India,positive,Cities to become water-secure
2022,Grey Water Recycling Promoted,Indian Express,positive,Circular economy in urban water
2022,Smart Water Meters Piloted,Economic Times,positive,Technology for efficient water management
2023,50% of AMRUT 2.0 Targets Achieved,Business Standard,positive,Strong progress on urban infrastructure
2023,Urban Flooding Solutions Implemented,The Hindu,positive,Climate adaptation in city planning
2024,Universal Urban Water Approaching,Times of India,positive,Near-complete coverage of cities
2024,Municipal Creditworthiness Improved,Indian Express,positive,Urban finance reforms showing results
2025,Near-Universal Urban Water Supply,Economic Times,positive,Historic achievement for urban India
2025,Smart Urban Water Networks Operational,Business Standard,positive,Digital water management active
