year,headline,source,sentiment,summary
2019,PM-KUSUM Launched for Solar Agriculture,Times of India,positive,25 GW solar target for farm sector
2020,Solar Pump Installation Gains Momentum,The Hindu,positive,Farmers adopt solar irrigation
2021,Feeder Solarization Pilot Launched,Indian Express,positive,Daytime power for agricultural areas
2022,4 Lakh Solar Pumps Installed,Economic Times,positive,Scale achievement in farm solar
2023,PM-KUSUM Target Raised to 30.8 GW,Business Standard,positive,Ambitious expansion of scheme
2024,PM Surya Ghar Complements KUSUM,The Hindu,positive,Comprehensive rural solar push
2025,15 Lakh Solar Pumps Achieved,Times of India,positive,India leads global agricultural solar
