year,headline,source,sentiment,summary
2005,NREGA Act Passed - Historic Employment Guarantee,The Hindu,positive,Parliament passes landmark NREGA legislation ensuring 100 days guaranteed employment per rural household
2005,Rural India Welcomes Job Security Law,Indian Express,positive,Civil society organizations hail NREGA as transformative step for rural poverty alleviation
2005,NREGA Implementation Concerns Raised,Economic Times,neutral,Experts warn about implementation challenges and need for robust monitoring mechanisms
2006,NREGA Launches from Anantpur District,Times of India,positive,Prime Minister launches NREGA from drought-prone Anantpur covering 200 districts initially
2006,States Struggle with NREGA Rollout,Business Standard,negative,Administrative bottlenecks delay NREGA implementation in several states
2006,NREGA Creates 90 Million Person-Days,The Hindu,positive,First year performance exceeds expectations with strong rural demand for work
2007,NREGA Expands to All Rural Districts,Indian Express,positive,World largest employment program now covers entire rural India with 615 districts
2007,Corruption Allegations Hit NREGA,Economic Times,negative,Multiple states report ghost workers and inflated muster rolls
2007,Women Participation in NREGA Grows,Times of India,positive,Female workers comprise 40% of NREGA workforce breaking traditional barriers
2008,NREGA Wage Rates Revised Upward,The Hindu,positive,Minimum wages increased to Rs 90 per day linking to agricultural labor rates
2008,Asset Creation Focus in NREGA,Business Standard,positive,Government emphasizes durable rural assets like ponds and irrigation channels
2008,Payment Delays Plague NREGA Workers,Indian Express,negative,Workers report 2-3 month delays in wage payments across states
2009,NREGA Becomes Recession Safety Net,Economic Times,positive,Budget doubled as program cushions rural economy from global crisis
2009,Record Demand for NREGA Employment,Times of India,positive,Economic slowdown drives surge in NREGA job applications
2009,NREGA Expenditure Crosses 27000 Crore,The Hindu,positive,Near-full budget utilization shows strong rural employment demand
2010,Women Now 48% of NREGA Workforce,Indian Express,positive,Gender parity almost achieved in rural employment guarantee scheme
2010,Water Conservation Works Prioritized,Business Standard,positive,NREGA focuses on drought-proofing with water harvesting structures
2010,NREGA Budget Touches 40000 Crore,Economic Times,positive,Largest social security allocation reflects government commitment
2011,NREGA Payment Delays Spark Protests,The Hindu,negative,Workers in multiple states protest pending wages and corruption
2011,Gram Panchayats Empowered Under NREGA,Times of India,positive,Decentralization gives local bodies greater control over implementation
2011,Social Audit Reveals NREGA Leakages,Indian Express,negative,Community audits expose fund diversion in several districts
2012,Digital Payments Launched for NREGA,Economic Times,positive,Electronic fund transfer to reduce corruption and delays
2012,NREGA Creates 230 Million Person-Days,Business Standard,neutral,Employment generation stable despite budget constraints
2012,Aadhaar Integration Planned for NREGA,The Hindu,neutral,Government announces biometric authentication for workers
2013,NREGA Renamed as MGNREGA,Indian Express,neutral,Scheme honors Mahatma Gandhi with name change to MGNREGA
2013,DBT Pilot in NREGA Shows Promise,Times of India,positive,Direct Benefit Transfer reduces intermediaries and leakage
2013,NREGA Budget Remains Flat at 33000 Crore,Economic Times,neutral,No allocation increase raises questions about government priorities
2014,New Government Questions NREGA Efficiency,Economic Times,negative,Finance Minister calls NREGA monument of failure sparking political debate
2014,NREGA Workers Demand Wage Hikes,The Hindu,negative,Labor unions protest stagnant wages not matching inflation
2014,Digital Muster Rolls Introduced,Business Standard,positive,Technology upgrade aims to eliminate ghost workers
2015,NREGA Budget Cuts Trigger Criticism,Indian Express,negative,Civil society warns of rural distress due to reduced allocation
2015,Aadhaar Made Mandatory for NREGA,Times of India,neutral,Biometric authentication now required for all workers
2015,NREGA Creates Assets Worth 3 Lakh Crore,The Hindu,positive,Cumulative value of rural assets since 2006 reaches milestone
2016,Geo-Tagging of NREGA Assets Begins,Economic Times,positive,GPS mapping of works improves transparency and accountability
2016,NREGA Allocation Increased to 38500 Crore,Business Standard,positive,Budget boost follows rural distress and farmer protests
2016,Digital Payments Reduce NREGA Corruption,Indian Express,positive,Electronic transfers show 95% payment efficiency
2017,NREGA Gets Record 48000 Crore Budget,The Hindu,positive,Drought conditions drive significant allocation increase
2017,Water Conservation Focus in NREGA,Times of India,positive,Climate adaptation works prioritized in scheme guidelines
2017,Pending NREGA Wages Cross 5000 Crore,Economic Times,negative,Fiscal pressure leads to payment delays across states
2018,NREGA Provides Critical Drought Relief,Indian Express,positive,Employment generation surges in drought-affected regions
2018,NREGA Wage Rates Revised to Rs 177,Business Standard,positive,Inflation indexing brings wage hike across all states
2018,Environmental Works Dominate NREGA,The Hindu,positive,Majority of projects now focus on natural resource management
2019,NREGA Funds Exhausted by December,Economic Times,negative,Budget shortfall leaves workers unpaid for three months
2019,Water Harvesting Creates 5 Lakh Structures,Times of India,positive,NREGA-built ponds and check dams boost groundwater
2019,Opposition Demands NREGA Budget Hike,Indian Express,negative,Political parties criticize inadequate rural employment funding
2020,NREGA Sees Record COVID Demand,The Hindu,positive,Migrant workers return to villages driving unprecedented enrollment
2020,NREGA Budget Doubled Mid-Year,Business Standard,positive,Pandemic response includes emergency rural employment allocation
2020,Digital Attendance Expanded Nationwide,Economic Times,positive,Mobile apps enable contactless worker registration and monitoring
2021,NREGA Gets Historic 73000 Crore,Indian Express,positive,Highest ever budget reflects continued rural employment needs
2021,Women Workers Cross 50% Mark,Times of India,positive,Female participation exceeds male enrollment for first time
2021,NREGA Key to Post-COVID Recovery,The Hindu,positive,Economists credit scheme for stabilizing rural consumption
2022,Fiscal Constraints Impact NREGA Spending,Economic Times,neutral,Budget held flat despite inflation and wage revisions
2022,Real-Time Monitoring System Launched,Business Standard,positive,AI-powered dashboard tracks NREGA implementation live
2022,NREGA Demand Normalizes Post-Pandemic,Indian Express,neutral,Employment generation returns to pre-COVID levels
2023,NREGA Budget Slashed to 60000 Crore,The Hindu,negative,Major cut despite 12000 crore pending liabilities
2023,Workers Protest Wage Payment Delays,Times of India,negative,Fiscal crunch leads to 3-4 month payment backlogs
2023,Green Jobs Integrated into NREGA,Economic Times,positive,Climate-focused works include plantation and soil conservation
2024,Election Year NREGA Boost to 86000 Crore,Indian Express,positive,Government increases allocation ahead of general elections
2024,Arrear Clearances Prioritized,Business Standard,positive,Pending wages from previous years being settled
2024,NREGA Completes 19 Years,The Hindu,positive,Scheme has generated over 30 billion person-days of employment
2025,AI Attendance System Rolled Out,Economic Times,positive,Facial recognition and geo-tagging automate worker verification
2025,Blockchain Pilot for NREGA Payments,Times of India,positive,Cryptocurrency-style ledger tested for transparent fund tracking
2025,NREGA Allocation Reaches 90000 Crore,Indian Express,positive,Continued commitment to rural employment guarantee scheme
