year,headline,source,sentiment,summary
2014,DAY-NULM Launched for Urban Poor,Times of India,positive,Comprehensive urban livelihoods mission
2018,60 Lakh Urban Poor in SHGs,The Hindu,positive,Social mobilization for self-help
2020,COVID Devastates Urban Poor,Indian Express,negative,Informal workers face livelihood crisis
2023,Industry 4.0 Skills Training,Economic Times,positive,Digital skills for urban workers
2025,Urban Poverty Targets Met,Business Standard,positive,Sustainable livelihoods achieved
