year,headline,source,sentiment,summary
2014,PM Launches Swachh Bharat Abhiyan,The Hindu,positive,Nation-wide cleanliness campaign aims to eliminate open defecation by 2019
2014,Corporate India Joins Sanitation Mission,Economic Times,positive,CSR funds allocated for toilet construction in rural and urban areas
2014,Behavior Change Key to Success Say Experts,Times of India,neutral,Analysts stress need for mindset shift beyond infrastructure building
2015,Toilet Construction Crosses 1 Crore Mark,Indian Express,positive,Rapid household sanitation infrastructure drives rural transformation
2015,Quality Concerns Over Rushed Toilet Building,Business Standard,negative,Reports of unusable toilets built just to meet targets
2015,Women Safety Improves with Toilets,The Hindu,positive,Household sanitation reduces harassment and health risks for women
2016,First ODF Districts Certified,Times of India,positive,Open defecation free status achieved in 125 districts nationwide
2016,Water Scarcity Threatens Toilet Usage,Indian Express,negative,Lack of water supply renders many new toilets non-functional
2016,Solid Waste Management Gains Focus,Economic Times,positive,Urban cleanliness drive expands beyond toilet construction
2017,Haryana Becomes First ODF State,Business Standard,positive,All villages in state certified as open defecation free
2017,Plastic Waste Choking Urban Drains,The Hindu,negative,Monsoon floods expose inadequate solid waste processing capacity
2017,Segregation at Source Campaigns Launched,Times of India,positive,Households trained to separate wet and dry garbage for recycling
2018,India Declares 4 Lakh Villages ODF,Indian Express,positive,Major milestone as open defecation eliminated in majority of rural India
2018,Single-Use Plastic Ban Announced,Economic Times,positive,Government prohibits manufacturing of several plastic items from 2022
2018,Toilet Maintenance Emerges as Challenge,Business Standard,negative,Many constructed toilets fall into disrepair due to lack of upkeep
2019,India Achieves ODF Status Nationwide,The Hindu,positive,Historic achievement as all villages certified open defecation free
2019,ODF Plus Sustainability Program Launched,Times of India,positive,Focus shifts to maintaining sanitation gains and waste management
2019,Reality Check Questions ODF Claims,Indian Express,negative,Independent surveys find continued open defecation in certified areas
2020,COVID Heightens Sanitation Awareness,Economic Times,positive,Pandemic underscores importance of hygiene and handwashing practices
2020,Migrant Crisis Strains Urban Sanitation,Business Standard,negative,Return of workers to villages tests toilet infrastructure capacity
2020,Swachh Bharat Completes 6 Years,The Hindu,positive,Program credited with massive improvement in public health outcomes
2021,Fecal Sludge Management Gets Priority,Times of India,positive,Septic tank cleaning and waste treatment plants established
2021,Grey Water Reuse Pilots Show Promise,Indian Express,positive,Wastewater recycling for agriculture reduces freshwater demand
2021,Rural Toilet Usage Rates Improve,Economic Times,positive,Behavior change shows sustained adoption beyond infrastructure
2022,Waste-to-Energy Plants Operational,Business Standard,positive,Garbage processing generates electricity in 150 cities
2022,ODF Plus Plus Certification Introduced,The Hindu,positive,Advanced standard includes liquid waste and plastic management
2022,Coastal Plastic Pollution Persists,Times of India,negative,Beach cleanup drives remove millions of tons of marine debris
2023,Compost from Waste Benefits Farmers,Indian Express,positive,Organic waste converted to fertilizer supports sustainable agriculture
2023,Extended Producer Responsibility Enforced,Economic Times,positive,Manufacturers required to collect and recycle plastic packaging
2023,Urban Drainage Improvements Needed,Business Standard,negative,Waterlogging during rains exposes inadequate stormwater systems
2024,Plastic Recycling Industry Grows,The Hindu,positive,Circular economy creates livelihood opportunities in waste sector
2024,Biodegradable Alternatives Gain Market Share,Times of India,positive,Eco-friendly packaging replaces single-use plastics in retail
2024,Village Ponds Rejuvenated from Waste Water,Indian Express,positive,Treated sewage recharges groundwater and supports ecosystems
2025,Zero Waste Cities Target Set for 100 Urban Centers,Economic Times,positive,Ambitious goal to eliminate landfill dumping by 2030
2025,Swachh Bharat Completes Decade,Business Standard,positive,Ten years of sanitation mission transforms India health and environment
2025,Behavior Sustainability Remains Challenge,The Hindu,negative,Littering and open defecation persist in pockets despite infrastructure
