year,headline,source,sentiment,summary
2015,UDAY Launched to Revive DISCOMs,Times of India,positive,State debt takeover for power distribution
2018,States Take Over Rs 2.32 Lakh Crore Debt,The Hindu,positive,Major DISCOM restructuring completed
2020,COVID Stresses DISCOM Finances Again,Indian Express,negative,Pandemic impacts power sector recovery
2023,RDSS Succeeds UDAY for Distribution Reform,Economic Times,positive,Smart metering focus in new scheme
2025,AT&C Losses Drop to 12%,Business Standard,positive,Distribution sector efficiency improves
